{
  "schema_version": "1",
  "record_type": "platform_authority_identity_enhanced_session_receipt",
  "environment": "non-production",
  "production": false,
  "status": "IDENTITY_ENHANCED_SESSION_CONSUMED",
  "binding_digest": "sha256:0101010101010101010101010101010101010101010101010101010101010101",
  "managed_policy_version": "vFutureReviewed",
  "managed_policy_digest": "sha256:0202020202020202020202020202020202020202020202020202020202020202",
  "required_action": "lambda:InvokeFunction",
  "role_kind": "classifier",
  "broker_alias": "classify",
  "expected_user_id_digest": "sha256:0303030303030303030303030303030303030303030303030303030303030303",
  "source_role_arn_digest": "sha256:0404040404040404040404040404040404040404040404040404040404040404",
  "target_role_arn_digest": "sha256:0505050505050505050505050505050505050505050505050505050505050505",
  "expires_at": "2030-01-01T00:15:00Z",
  "token_issued": true,
  "sts_session_issued": true,
  "session_consumed": true,
  "broker_invocation_performed": false,
  "live_retirement_authorized": false,
  "receipt_digest": "sha256:091a6f8fcc0983577fa5730a4792a546687257ba1d6bd62b895dc5dfc96cf54d"
}
